{
  "adapter_smoke_version": "agentic-flows.adapter-smoke/v1",
  "consumer": "thinclaw",
  "flow": {
    "id": "engineering.issue-backlog-grooming",
    "version": "0.1.0",
    "source": "flows/engineering/issue-backlog-grooming/flow.yaml"
  },
  "capability_support": [
    "issue.read",
    "evidence.capture"
  ],
  "node_type_mappings": {
    "agent_task": "worker task",
    "finalizer": "closeout step",
    "intake": "intake step",
    "verifier": "verifier step"
  },
  "run_bundle": "runs/thinclaw-issue-backlog-grooming.run.json",
  "negative_run_bundle": {
    "source": "../../tests/fixtures/invalid-run-missing-gate.json",
    "expected_error": "required quality gate"
  },
  "notes": "Repo-local contract smoke for a possible ThinClaw issue-backlog-grooming adapter."
}
