{
  "adapter_smoke_version": "agentic-flows.adapter-smoke/v1",
  "consumer": "thinclaw",
  "flow": {
    "id": "research.technology-radar",
    "version": "0.1.0",
    "source": "flows/research/technology-radar/flow.yaml"
  },
  "capability_support": [
    "source.retrieve",
    "evidence.capture"
  ],
  "node_type_mappings": {
    "agent_task": "worker task",
    "finalizer": "closeout step",
    "intake": "intake step",
    "verifier": "verifier step"
  },
  "run_bundle": "runs/thinclaw-technology-radar.run.json",
  "negative_run_bundle": {
    "source": "../../tests/fixtures/invalid-run-missing-gate.json",
    "expected_error": "required quality gate"
  },
  "notes": "Repo-local contract smoke for a possible ThinClaw technology-radar adapter."
}
