{
  "adapter_smoke_version": "agentic-flows.adapter-smoke/v1",
  "consumer": "nilcore",
  "flow": {
    "id": "engineering.large-refactor-safe-plan",
    "version": "0.1.0",
    "source": "flows/engineering/large-refactor-safe-plan/flow.yaml"
  },
  "capability_support": [
    "repo.checkout",
    "command.run",
    "evidence.capture"
  ],
  "node_type_mappings": {
    "agent_task": "worker task",
    "finalizer": "closeout step",
    "intake": "intake step",
    "plan": "planning step",
    "tool": "tool runner",
    "verifier": "verifier step"
  },
  "run_bundle": "runs/nilcore-large-refactor-safe-plan.run.json",
  "negative_run_bundle": {
    "source": "../../tests/fixtures/invalid-run-missing-gate.json",
    "expected_error": "required quality gate"
  },
  "notes": "Repo-local contract smoke for a possible NilCore large-refactor-safe-plan adapter."
}
