{
  "adapter_smoke_version": "agentic-flows.adapter-smoke/v1",
  "consumer": "crustcore",
  "flow": {
    "id": "program.connector-productionization",
    "version": "0.1.0",
    "source": "flows/program/connector-productionization/flow.yaml"
  },
  "capability_support": [
    "connector.read",
    "command.run",
    "human.review",
    "evidence.capture"
  ],
  "node_type_mappings": {
    "agent_task": "worker task",
    "finalizer": "closeout step",
    "intake": "intake step",
    "tool": "tool runner",
    "verifier": "verifier step"
  },
  "run_bundle": "runs/crustcore-connector-productionization.run.json",
  "negative_run_bundle": {
    "source": "../../tests/fixtures/invalid-run-missing-gate.json",
    "expected_error": "required quality gate"
  },
  "notes": "Repo-local contract smoke for a possible CrustCore connector-productionization adapter."
}
