{
  "adapter_smoke_version": "agentic-flows.adapter-smoke/v1",
  "consumer": "thinclaw",
  "flow": {
    "id": "ops.incident-response",
    "version": "0.1.0",
    "source": "flows/ops/incident-response/flow.yaml"
  },
  "capability_support": [
    "incident.read",
    "human.review",
    "decision.record",
    "evidence.capture"
  ],
  "node_type_mappings": {
    "agent_task": "worker task",
    "decision": "decision step",
    "finalizer": "closeout step",
    "intake": "intake step",
    "tool": "tool runner",
    "verifier": "verifier step"
  },
  "run_bundle": "runs/thinclaw-incident-response.run.json",
  "negative_run_bundle": {
    "source": "../../tests/fixtures/invalid-run-missing-gate.json",
    "expected_error": "required quality gate"
  },
  "notes": "Repo-local contract smoke for a possible ThinClaw incident-response adapter."
}
