{
  "adapter_smoke_version": "agentic-flows.adapter-smoke/v1",
  "consumer": "crustcore",
  "flow": {
    "id": "security.untrusted-output-routing",
    "version": "0.1.0",
    "source": "flows/security/untrusted-output-routing/flow.yaml"
  },
  "capability_support": [
    "taint.track",
    "policy.evaluate",
    "evidence.capture"
  ],
  "node_type_mappings": {
    "agent_task": "worker task",
    "finalizer": "closeout step",
    "intake": "intake step",
    "tool": "tool runner",
    "verifier": "verifier step"
  },
  "run_bundle": "runs/crustcore-untrusted-output-routing.run.json",
  "negative_run_bundle": {
    "source": "../../tests/fixtures/invalid-run-missing-gate.json",
    "expected_error": "required quality gate"
  },
  "notes": "Repo-local contract smoke for a possible CrustCore untrusted-output-routing adapter."
}
